{
    "workflow_file": {
        "path": "../test/workflowfiles/dummyworkflow.cwl"
    },
    "output_directory": {
        "path": "../tmp/dummydata"
    },
    "container_cache_directory": {
        "path": "../tmp/dummycachedir"
    },
    "reference": {
        "path": "../test/secondaryfile/case1.fasta"
    },
    "sortsam_max_records_in_ram": 5000000,
    "sortsam_java_options": "-XX:-UseContainerSupport -Xmx30g",
    "cores": 16,
    "bwa_bases_per_batch": 10000000,
    "use_bqsr": false,
    "dbsnp": {
        "path": "../test/referencefiles/dummy.dbsnp.vcf"
    },
    "mills": {
        "path": "../test/referencefiles/dummy.mills.vcf.gz"
    },
    "known_indels": {
        "path": "../test/referencefiles/dummy.known_indels.vcf.gz"
    },
    "haplotypecaller_autosome_PAR_interval_bed":{
        "path": "../test/referencefiles/dummy.autosome-PAR.bed"
    },
    "haplotypecaller_autosome_PAR_interval_list":{
        "path": "../test/referencefiles/dummy.autosome-PAR.interval_list"
    },
    "haplotypecaller_chrX_nonPAR_interval_bed":{
        "path": "../test/referencefiles/dummy.chrX-nonPAR.bed"
    },
    "haplotypecaller_chrX_nonPAR_interval_list":{
        "path": "../test/referencefiles/dummy.chrX-nonPAR.interval_list"
    },
    "haplotypecaller_chrY_nonPAR_interval_bed":{
        "path": "../test/referencefiles/dummy.chrY-nonPAR.bed"
    },
    "haplotypecaller_chrY_nonPAR_interval_list":{
        "path": "../test/referencefiles/dummy.chrY-nonPAR.interval_list"
    }

}
